title,post_user,post_time,type,links,post_reply,post_viewer,post_content
deepin V23 release更新日志2024年5月17日, deepin小助手 , 2024-05-17 15:34 , 【版本内测】 ,https://bbs.deepin.org/zh/post/272523,32,3643,
生态共建小组阶段性工作汇报 & 2024年第1期wine打包活动总结, 应用商店-小鱿鱼 , 1 天前 , 【官方活动】 ,https://bbs.deepin.org/zh/post/272733,8,527,嗨，你来了。感谢关注呢。🙂
deepin V23 RC发布日志, deepin小助手 , 2024-05-15 17:10 , 【论坛公告】 ,https://bbs.deepin.org/zh/post/272364,94,6664,重要提示：
升级deepin v23 RC玲珑应用丢失解决方案及FAQ, deepin小助手 , 2024-05-15 15:57 , 【论坛公告】 ,https://bbs.deepin.org/zh/post/272355,19,2353,一、背景
【产品面对面】V23 RC任务栏、启动器功能杂谈！, Merlin , 2024-05-08 14:03 , 【深度探索】 ,https://bbs.deepin.org/zh/post/272004,89,4767,RC版本发布临近，此贴会置顶一周，希望大家可以通过此贴了解全新任务栏和启动器，大家可在此贴中交流避免发散反馈。
WHLUG议题揭晓，5月25日，一场技术盛宴等你来 | 文末有彩蛋, deepin小助手 , 6 分钟前 , 【官方活动】 ,https://bbs.deepin.org/zh/post/272810,0,14,Hi，Linuxer！
开始正式使用V23了，专门准备了一块硬盘, flashpig8014 , 18 分钟前 , 【交流分享】 ,https://bbs.deepin.org/zh/post/272809,1,33,主力工作机开始正式使用V23，专门准备了一块硬盘装V23，挺香。
关于回收站没有右键无清空以及图标不变化, 136******71 , 33 分钟前 , 【问题求助】 ,https://bbs.deepin.org/zh/post/272808,1,33,从beta3升级至RC后，并且执行了玲珑重新安装工具（不知道有没有关系）：
qq的消息通知太烦人了，通知关闭不了, 天天，天天开心 , 38 分钟前 , 【改进建议】 ,https://bbs.deepin.org/zh/post/272807,5,65,
qq的消息通知太烦人了，关闭不了通知
已更新V23 release,Qt Creator依然不能中文输入编辑。, 深度之家 , 1 小时前 , 【其他】 ,https://bbs.deepin.org/zh/post/272806,1,36,NA
通过脚本获取论坛最新信息及搭建一个rss源的可能, fallingstar-ten , 1 小时前 , 【其他】 ,https://bbs.deepin.org/zh/post/272805,6,76,由于论坛没有rss功能，需要手动对论坛数据进行爬取生成摘要进行阅读，我们用R语言写了一段论坛的爬虫。但是貌似爬到了英文版的社区站（？）
overlayroot卸载失败导致apt无法使用。, lyquid , 1 小时前 , 【第三方应用】 ,https://bbs.deepin.org/zh/post/272804,4,60,不知道为什么overlayroot被dpkg标记为卸载状态，但又无法卸载成功，导致apt无法正常使用，安装新软件包时都会尝试删除overlayroot。
急！！官网下载的镜像用U盘制作的启动盘在电脑启动的时候不显示, huazelei119 , 2 小时前 , 【问题求助】 ,https://bbs.deepin.org/zh/post/272803,6,87,官网下载的镜像，用镜像解压出来的工具制作了U盘启动盘，但是在电脑重新启动的时候不显示这个启动引导盘是什么原因？这个U盘制作win的启动引导盘可以显示。急，在线等
有没有好用的 笔记整理软件, 廿五 , 2 小时前 , 【问题求助】 ,https://bbs.deepin.org/zh/post/272802,3,89,如题 有没有好用的 知识笔记整理app
搜狗输入法崩溃, shamar , 2 小时前 , 【第三方应用】 ,https://bbs.deepin.org/zh/post/272801,2,74,搜狗输入法崩溃在使用中会突然退出，输入法就不见了什么快捷键也无法切换出来。
V23社区版（Preview)RC，设置中心更新提示依赖错误, 深度之家 , 2 小时前 , 【其他】 ,https://bbs.deepin.org/zh/post/272800,2,37,NA
deepin V23.01.00.25 升级后玲珑的浏览器无法打开了, 高贵妃广告 , 2 小时前 , 【玲珑】 ,https://bbs.deepin.org/zh/post/272799,5,60,
virtualbox如何安装。, 徘徊者 , 3 小时前 , 【问题求助】 ,https://bbs.deepin.org/zh/post/272797,14,294,6.6.25-amd64-desktop-hwe #23.01.00.25 SMP PREEMPT_DYNAMIC Wed Apr 10 21:20:25 CST 2024 x86_64 GNU/Linux
V23RC安装后直接覆盖EFI中20.9启动文件, 深度之家 , 3 小时前 , 【其他】 ,https://bbs.deepin.org/zh/post/272796,2,64,NA
AI绘图：老照片修复&漫画重绘, Gnomic , 3 小时前 , 【经验分享】 ,https://bbs.deepin.org/zh/post/272795,4,88,重拾时光的温暖，让记忆在清晰中绽放
刚才虚拟机安装了Deepin 23 RC版说一下体验和建议, 酷谷的谷子 , 3 小时前 , 【心情随笔】 ,https://bbs.deepin.org/zh/post/272794,2,114,刚才虚拟机安装了Deepin 23 RC版说一下体验和建议
deepin v23 RC 依赖于libmpv应用视频硬解问题折腾过程, 心持恒 , 4 小时前 , 【交流分享】 ,https://bbs.deepin.org/zh/post/272793,1,103,1.之前出问题的机器为GPD小主机，cpu为N4100,配套显卡UHD Graphics 600;
RC版本更新后桌面黑屏，图标消失，挂载硬盘缓慢, 深度之家 , 4 小时前 , 【其他】 ,https://bbs.deepin.org/zh/post/272792,1,43,NA
建议论坛上线一个弱的屏蔽功能, fallingstar-ten , 4 小时前 , 【论坛建议】 ,https://bbs.deepin.org/zh/post/272791,10,206,类似微博/自媒体那种拉黑和屏蔽的功能此前已经在论坛里提过好几次了，在讨论中也主要是认为，平台应该允许不同的声音存在、不喜欢不看不评论就好了或者自研论坛添加此功能不易的问题，总之，在此前多次的讨论中，类似的功能一直没有实现，回顾可见：1. https://bbs.deepin.org/post/261252 2. https://bbs.deepin.org/post/254648 3. https://bbs.deepin.org/post/231351。
华为matebook e 2022能装deepin吗？, 156******79 , 4 小时前 , 【深度探索】 ,https://bbs.deepin.org/zh/post/272790,12,148,一直想用深度，想知道华为matebook e 2022能装deepin吗？
UOS论坛无法登陆, 深度之家 , 5 小时前 , 【其他】 ,https://bbs.deepin.org/zh/post/272789,3,91,NA
请教桌面快捷方式没法打开程序，但是在应用商店安装界面可以打开, paloffice , 5 小时前 , 【问题求助】 ,https://bbs.deepin.org/zh/post/272788,3,83,我在应用商店安装了一个软件，安装后在桌面自动创建了快捷方式，但是在开始菜单里面没有创建项目，我在应用商店的软件安装界面可以点击打开这个软件，但是在桌面快捷方式双击却没有反映，这个如何修复？
今天第5次献血，自疫情以来总共1800CC, 晚秋（lateautumn） , 5 小时前 , 【心情随笔】 ,https://bbs.deepin.org/zh/post/272787,15,298,另外：借此也发表一下感言：我相信大多数坛友与我一样都是有爱心的人，都是期望深度发展的得越来越好的人。所以也真诚希望坛友在遇到不同观点的回贴时，控制一下自己情绪，把不同的观点控制在争论争辩状态，不要演变成争吵甚至互骂互相讽刺挖苦。
再者：我是一个不懂计算机技术的人，虽然用深度系统有660多天，但也顶多算个大白。作为多届的版主，在处理争端时，也许因为能力所限，有不公正、不公平的地方，希望坛友们多多原谅。我认为版主真的没有什么特权，是为坛友服务的，我们不拿工资，是用我们的工作之余或课外之余为坛友们服务。我们的能力肯定有限，但我们对深度的爱无限。
一些问题和一些建议, 酷谷的谷子 , 6 小时前 , 【改进建议】 ,https://bbs.deepin.org/zh/post/272786,2,147,建议一个问题，就是有些应用，在默认源理由但是安装了系统就会出问题
wine安装windows下的exe应用。, 长风 , 6 小时前 , 【深度探索】 ,https://bbs.deepin.org/zh/post/272785,9,336,wine3.8安装windows下的exe应用。同一个windows下的exe应用，版本不同，低版本能安装也能运行，但该应用进入后强制升级到新版本，升级后就没法启动了。
开机后桌面图标消失，背景黑色，右键失效, 深度之家 , 6 小时前 , 【其他】 ,https://bbs.deepin.org/zh/post/272784,2,135,NA
如何用 Sandboxie-Plus 管住「不听话」的软件, 流浪的加菲 , 6 小时前 , 【内容转载】 ,https://bbs.deepin.org/zh/post/272783,3,106,写在最前面：这是篇以Windows为系统环境讲解的软件使用教程，并不是很技术的分享，只是觉得这篇文章可以给大家折腾系统和软件提供一些思路，搬过来分享给大家。（想起了 玲珑🤧 ）
升级到v23 RC版，Fail to start nmdb.service导致系统无法启动, unpack , 6 小时前 , 【启动/关机】 ,https://bbs.deepin.org/zh/post/272782,5,64,我从v23的预览版升级到RC版，安装了JDK 8,11,17,21, golang，Jetbrains Fleet，新版飞书，然后重启，发现系统无法启动了，提升[FAILED]Fail to start nmdb.service - Samba NMB Daemon.
论坛能不能开放悬赏wine服务, a1124258836 , 6 小时前 , 【wine专区】 ,https://bbs.deepin.org/zh/post/272780,27,366,论坛能不能开放悬赏有偿wine服务，方便一些有特殊小众软件需求的用户能在deepin上用上暂时没有适配的或者不方便官方上架的小众软件。这样既满足用户需求，又不让大佬们靠爱发电。
安装时分区列表是空的,无法安装,本机磁盘信息如图, kerryzhu , 6 小时前 , 【问题求助】 ,https://bbs.deepin.org/zh/post/272779,6,105,用diskG格式化了一个ext4的分区，然后在安装的时候死活显示不出来,格式化成各种格式都试了，分区列表都是空的
开源浏览器内核流行趋势, 度深蓝 , 6 小时前 , 【话题讨论】 ,https://bbs.deepin.org/zh/post/272778,12,322,现阶段浏览器内核，用的最多的应该是谷歌浏览器的内核，连微软的浏览器都是用他的内核。除此之外，就是国外社区系统的“御用”浏览器，火狐。算作开源项目的典范。
deepin wsl 更新 1.0.2.0 版本, 空木蓮華 , 7 小时前 , 【内容投稿】 ,https://bbs.deepin.org/zh/post/272777,2,173,deepin rc 发版，deepin-WSL 更新版本。
更新内容不能简略, 深度之家 , 7 小时前 , 【其他】 ,https://bbs.deepin.org/zh/post/272776,1,117,NA
系统安装分区建议, a1124258836 , 7 小时前 , 【系统安装】 ,https://bbs.deepin.org/zh/post/272775,11,223,今天在浏览startos官网时发了一个不错的关于linux分区介绍的文章https://www.startos.com/help_7.html，有一点值得学习。建议deepin也在分区的时候加几个汉字提示，方便大家理解。
常用区域的空白有点大，感觉总是怪怪的，能处理了吗？, buyike , 7 小时前 , 【启动器】 ,https://bbs.deepin.org/zh/post/272774,3,140,右边常用区域下边空白比较多，短了一节，左边区域默认下文字和线距离太近，不知能否稍稍加大一点高度，让左边文字不要和分割线如此接近，同时也可为右边常用区域增加一行图标，另外，稳定下来后上面的我的常用几个文字能和最近安装一起隐藏是最好，方案仅供参考。
deepin 文本编辑器, 131******20 , 7 小时前 , 【其他】 ,https://bbs.deepin.org/zh/post/272773,2,134,linux下有没有带有申请root权限功能的文本编辑器，比如说界面里带管理员模式打开，或者保存系统文件的时候需要root权限会弹窗让你输密码，不需要在终端里sudo的
终端最大化会被下方任务栏遮挡, 续哈哈 , 7 小时前 , 【终端】 ,https://bbs.deepin.org/zh/post/272772,3,95,终端最大化会被下方任务栏遮挡一行
这应该算低级BUG吧, iistone , 7 小时前 , 【音乐】 ,https://bbs.deepin.org/zh/post/272771,1,176,单选框、复选框选中后的外部的光圈效果位置偏了！
飞腾d2000/4的cpu，装了arm的v23，启动没法引导进系统, 晓春 , 8 小时前 , 【问题求助】 ,https://bbs.deepin.org/zh/post/272770,3,105,live版系统可以进，安装过程也很顺利，但安装完重启后就无法引导进系统，怎么解决。是飞腾d2000/4处理器的国产电脑。
关于deepin安装安卓APK问题, Rufu墨麟 , 8 小时前 , 【问题求助】 ,https://bbs.deepin.org/zh/post/272769,2,163,
任务栏图标错误, 深度之家 , 8 小时前 , 【其他】 ,https://bbs.deepin.org/zh/post/272768,1,45,NA
用VMware 或者Hyper-V安装ISO文件失败, Wesley , 8 小时前 , 【其他】 ,https://bbs.deepin.org/zh/post/272767,1,74,用VMware 或者Hyper-V安装最新ISO文件失败，出现“OPerating System not found”
deepin支持在同一块硬盘上分区ext4和xfs吗？会有冲突吗, null , 8 小时前 , 【其他】 ,https://bbs.deepin.org/zh/post/272766,6,158,自己加了了一块盘，分了两个区，打算分sdc1为ext4,sdc2为xfs,一个挂载在date（xfs），下一个挂载在home（ex4）下
从beta3到RC，intel声卡都没有正确驱动, remyxo , 9 小时前 , 【改进建议】 ,https://bbs.deepin.org/zh/post/272765,7,267,我的笔记本是荣耀MagicBook X14，配置：
更新chrome之后，chrome总是卡死，怎么办？, 挨踢螺 , 9 小时前 , 【卡死/卡顿】 ,https://bbs.deepin.org/zh/post/272764,1,56,系统信息如下
win10
双系统，时间不对, 深度之家 , 9 小时前 , 【其他】 ,https://bbs.deepin.org/zh/post/272763,1,111,NA
进程里多了个红移是啥, 立青 , 9 小时前 , 【交流分享】 ,https://bbs.deepin.org/zh/post/272762,8,302,1、进程里多了个红移，就是本次升级后出现的，不知道是干啥的
复制文件到U盘时，100%后仍然是同步中。。。, loong , 18 小时前 , 【文件管理器】 ,https://bbs.deepin.org/zh/post/272761,14,205,如下图所示， 明明文件 已经 复制完成 了， 但是就是不结束，显示 “同步中“， 看起来很吓人， 到底完成 了没有？文件 有没有损坏？？
7.20日点击回收站无限多开无最小化, 佐罗 , 18 小时前 , 【其他】 ,https://bbs.deepin.org/zh/post/272760,2,93,以前从没有打开过回收站，本来是想看看图标动画的，在点到回收站时发现不能最小化而是又打开了多个窗口， 算是bug吗？
任务栏不能更改位置, 深度之家 , 18 小时前 , 【其他】 ,https://bbs.deepin.org/zh/post/272759,2,65,NA
安装界面光标不显示, wuzhican , 18 小时前 , 【问题求助】 ,https://bbs.deepin.org/zh/post/272758,1,52,使用6.*的内核版本进入安装界面，界面有响应，但是光标不显示。使用显卡安全模式，可以显示光标。
应用商店无法打开, ji-entropy , 18 小时前 , 【应用商店】 ,https://bbs.deepin.org/zh/post/272757,4,71,我是在移动固态硬盘安装deepin，无法打开应用商店，重启也不行
很好奇现在深度的用户使用的系统都是哪些系统？, 贺东明 , 18 小时前 , 【话题讨论】 ,https://bbs.deepin.org/zh/post/272756,11,373,很好奇现在深度的用户使用的系统都是哪些系统？不知道官方有没有统计数据。在3个月内有使用记录的深度系统用户中，每个版本的使用人数，建议隔一段时间公开一下，如果人数不方便公开，那也可以公开一下每个版本的使用人数比例。
都别吵了，我来发个自定义debian12.5镜像, chmod700 , 19 小时前 , 【其他】 ,https://bbs.deepin.org/zh/post/272755,15,524,一天到晚的吵吵，一点油盐都没有。就知道抱怨 v23 不稳定，不稳定你换别的发行版啊，Linux 缺软件，又不缺发行版，稳定可靠的发行版一大堆，赖着 deepin 不走干嘛？不会是你水平菜，没有个简单易用的软件商店，你装软件都不会吧？
deepin23 rc最新版在有道词典官方下载deepin安装包安装时提示依赖不足, 深度之家 , 19 小时前 , 【其他】 ,https://bbs.deepin.org/zh/post/272754,2,60,NA
更新提示安装包错误, 大脑袋妈 , 19 小时前 , 【问题求助】 ,https://bbs.deepin.org/zh/post/272753,1,341,
Git远程代码执行漏洞，或影响win、mac用户, wlly-lzh , 19 小时前 , 【其他】 ,https://bbs.deepin.org/zh/post/272752,1,122,漏洞编号：QVD-2024-18126,CVE-2024-32002
同时插两个优盘，弹出其中一个，另外一个也弹出, gangzai0707 , 20 小时前 , 【深度探索】 ,https://bbs.deepin.org/zh/post/272751,1,86,同时插两个优盘先插1，后插2
自带浏览器无法上网、导入书签, 深度之家 , 20 小时前 , 【其他】 ,https://bbs.deepin.org/zh/post/272750,3,64,NA
现在删除文件总是提示无法放入回收站, 离 , 21 小时前 , 【问题求助】 ,https://bbs.deepin.org/zh/post/272748,7,125,如题，我现在不管删除什么文件，都会显示无法放入回收站问我是否要删除23333
系统盘占用很大啊，哪些可以删除呢？, 189******13 , 21 小时前 , 【问题求助】 ,https://bbs.deepin.org/zh/post/272747,6,186,系统盘占用很大啊，哪些可以删除呢？
浏览器复制死机, 深度之家 , 21 小时前 , 【其他】 ,https://bbs.deepin.org/zh/post/272746,1,36,NA
小企鹅输入法5怎么设置大写字母直接上屏, 老咸鱼 , 1 天前 , 【问题求助】 ,https://bbs.deepin.org/zh/post/272745,10,150,有人知道安卓版小企鹅输入法5怎么设置大写字母直接上屏吗？
玲珑浏览器安装太慢, 深度之家 , 1 天前 , 【其他】 ,https://bbs.deepin.org/zh/post/272744,3,184,NA
壁纸分享, 度深蓝 , 1 天前 , 【壁纸】 ,https://bbs.deepin.org/zh/post/272743,11,267,NA
Linux之父不仅暴脾气，“吃狗粮”也是最积极！, 庆余年 , 1 天前 , 【心情随笔】 ,https://bbs.deepin.org/zh/post/272742,7,499,原文链接
v23 RC 桌面快捷方式权限（应用商店应用 多个近期安装仅只读，早期安装正常）, 深度之家 , 1 天前 , 【其他】 ,https://bbs.deepin.org/zh/post/272741,1,79,NA
【转】某大神对 鸿蒙 的评论, 庆余年 , 1 天前 , 【心情随笔】 ,https://bbs.deepin.org/zh/post/272740,15,569,
浏览器无法访问百度网页, Lavender , 1 天前 , 【问题求助】 ,https://bbs.deepin.org/zh/post/272739,3,103,系统使用无线连接 打开自带浏览器输入baidu显示无法找到服务器IP 已知电脑网络是正常连接、可以正常检测到系统更新、QQ登录、微信登录等、对无线网络连接使用了指定的DNS114.114.114.114就是无法打开百度及其它的网页 求解~~~
deepinv23 龙芯版 qq和VSCodium启动很慢问题及临时结局方案, 心持恒 , 1 天前 , 【交流分享】 ,https://bbs.deepin.org/zh/post/272738,8,279,qq和vscodium都从星火商店安装，用命令直接打开都没问题秒开，但直接点击图标启动则会很慢并以下进程占用非常高
没有显示设备驱动信息, 迷你球 , 1 天前 , 【设备管理器】 ,https://bbs.deepin.org/zh/post/272737,1,82,插入设备时，没有显示设备对应的驱动供安装
任务栏配置不能保存, kingecg , 1 天前 , 【任务栏】 ,https://bbs.deepin.org/zh/post/272736,2,75,版本：V23 RC
21.9软件中心安装坚果云不能登录, 130******90 , 1 天前 , 【深度探索】 ,https://bbs.deepin.org/zh/post/272735,0,77,深度21.9软件中心安装坚果云不能登录，咋回事啊？麻烦大佬帮帮我！谢谢
安装器：安装软件，依赖关系不足, 深度之家 , 1 天前 , 【其他】 ,https://bbs.deepin.org/zh/post/272734,2,87,NA
每次系统升级后，系统盘都会变大，怎么解决或者删除不用的东西。, 时光正好 , 1 天前 , 【系统安装】 ,https://bbs.deepin.org/zh/post/272732,10,447,每次系统升级后，系统盘都会变大，怎么解决或者删除不用的东西。（不懂技术，小白一个）
安装界面黑屏, 133******34 , 2024-05-20 16:41 , 【问题求助】 ,https://bbs.deepin.org/zh/post/272731,13,98,安装界面代码刷完黑屏或有时候直接卡代码...关闭了快速启动...BAR关闭...集成网卡禁用.取掉双显卡(950)拔掉双显示器(2).都无法进入安装界面...每次卡代码不同..有时候代码刷完黑屏
安装不到半个月的系统，数据盘却占用了一半，为什么？, 189******45 , 2024-05-20 16:35 , 【新手教程】 ,https://bbs.deepin.org/zh/post/272730,7,648,系统是5月9日安装的，不到半个月，就安装了wps和360浏览器，为什么会占用这么多？
深度仓库无法访问, 神末shenmo , 2024-05-20 16:17 , 【仓库/镜像】 ,https://bbs.deepin.org/zh/post/272729,6,188,辽宁联通
硬盘格式修改, 呜喵王 , 2024-05-20 16:05 , 【交流分享】 ,https://bbs.deepin.org/zh/post/272728,2,118,玩了一段时间linux后，重装新的Deepin V23 RC，遂分区2个：
1）boot/efi      500MB，任性
2）/                   剩下的900多GB，详见下图
小瑕疵 软件包安装器文字显示不全, 深度之家 , 2024-05-20 16:00 , 【其他】 ,https://bbs.deepin.org/zh/post/272727,1,84,NA
在deepin里面如何用R语言下载一本小说的简单示例, fallingstar-ten , 2024-05-20 15:28 , 【其他】 ,https://bbs.deepin.org/zh/post/272726,2,138,玩点好玩的吧大家，少点争吵 ，love&peace！
mysql8.4中文手册, wlly-lzh , 2024-05-20 15:18 , 【翻译汉化】 ,https://bbs.deepin.org/zh/post/272725,2,116,网址：https://cunzaima.cn/mysql8.4-zh/dev.mysql.com/doc/refman/8.4/en/index.html
有人知道文件输入/输出错误是什么问题嘛？, 离 , 2024-05-20 15:11 , 【改进建议】 ,https://bbs.deepin.org/zh/post/272724,3,80,如下图：
截图功能不能用了, 立青 , 2024-05-20 15:09 , 【问题求助】 ,https://bbs.deepin.org/zh/post/272723,11,283,上周就发生了，按Ctr+alt+a,没有反映，我打开设置查看，截图快捷键没有问题，但怎么按都没用，改一个快捷键也没有用，甚至按PrintScreen键也没有效果，有办法修复吗？
任务栏位置改变不了, 深度之家 , 2024-05-20 15:00 , 【其他】 ,https://bbs.deepin.org/zh/post/272722,1,69,NA
V23rc鼠标指针消失, Excalibur9527 , 2024-05-20 14:55 , 【系统安装】 ,https://bbs.deepin.org/zh/post/272721,2,88,从安装界面就看不见鼠标指针，勉强靠摸索安装，结果开机之后输入用户名称过不去，根本找不到鼠标位置，b站也有人反馈相同问题，显示器分辨率4k，不知道是不是和显示器有关？
继续讨论：时效的问题。, kuxise , 2024-05-20 14:50 , 【心情随笔】 ,https://bbs.deepin.org/zh/post/272720,0,210,1、个人觉得，关于时效还是有必要的，要不然一直找老帐，时间精力消耗不起，就是法律上也有这一说，讨帐也还有时效呢，过期失效/。
AI绘图：愿爱在你左右（附提示词）, Gnomic , 2024-05-20 14:45 , 【经验分享】 ,https://bbs.deepin.org/zh/post/272719,2,101,提示词：夜晚，丰富多彩的，天空中满是烟花，心形气泡，卡通，胖乎乎的和小男孩互相拥抱，周圍有發光的螢火蟲，兒童插畫，發光效果，景深，強調，真實的光，射線追蹤，oc 渲染，超现实主义，最好的品质，8K，大师作品
重要的系统应用不应该提供右键卸载选项, Tonny , 2024-05-20 14:17 , 【改进建议】 ,https://bbs.deepin.org/zh/post/272717,22,320,右键卸载选项可能让我们这些小白误以为这个软件不是很重要，稀里糊涂就卸载了。
为啥升级的时候一定要备份啊？, huazelei119 , 2024-05-20 13:53 , 【改进建议】 ,https://bbs.deepin.org/zh/post/272716,12,396,如题  为啥升级前一定要备份啊？就升级个安全补丁都还要备份半天    真的是服了。备份文件又占内存，本来就是折腾版本的系统，升级有问题重装呗，又不是商业版用途的系统。或者给给开关都行，把选择权交给用户。
希望添加AMD-RAID的驱动（如果有）, kiana , 2024-05-20 13:23 , 【改进建议】 ,https://bbs.deepin.org/zh/post/272715,4,172,cpu是5600G，主板是华硕B550，使用了主板的RAID将两块SATA的SSD组成R0，安装系统时发现无法识别硬盘，包括SSD阵列和独立的SATA硬盘
论坛改进建议（0.2）, dpme , 2024-05-20 13:09 , 【论坛建议】 ,https://bbs.deepin.org/zh/post/272714,7,249,NA
提个建议，不适配当前系统的应用不要下架, userqian , 2024-05-20 13:08 , 【心情随笔】 ,https://bbs.deepin.org/zh/post/272713,11,265,提个建议，应用商店不适配当前系统的应用不要下架，就是把安装按钮变成灰色，显示不兼容即可，或者显示下当前应用兼容的系统版本，然后大家可以催更，现在的感觉就是应用商店里面的有些常用应用，莫秒奇妙的消失了，不知道啥原因
V23中如何使用V20的源安装软件, paloffice , 2024-05-20 12:29 , 【问题求助】 ,https://bbs.deepin.org/zh/post/272712,10,217,我有个软件在V20里面有，但是到了V23里面没有了，有没有办法临时添加一下V20的源，安装这个软件
启动菜单里面的项目图标丢失, paloffice , 2024-05-20 12:13 , 【问题求助】 ,https://bbs.deepin.org/zh/post/272711,3,75,桌面图标显示正常，但是启动菜单里面图标显示不了，这是什么原因呀，能解决吗？
打包deb-自动导入docker镜像-自动创建容器, 酷谷的谷子 , 2024-05-20 11:24 , 【内容投稿】 ,https://bbs.deepin.org/zh/post/272710,9,266,现在docker容器使用越来越频繁 所以做了一个  打包 docker 镜像 导入 这样一个模板
Android 15 Beta 2，原生的应用多开方案来了, 流浪的加菲 , 2024-05-20 11:22 , 【行业资讯】 ,https://bbs.deepin.org/zh/post/272709,3,313,5 月 16 日凌晨，Android 15 向包括 Pixel 8a 在内的机型推送了第二个测试版本。
论坛内你们能锁，论坛外呢？也能锁吗？当了版主能上天了？, kuxise , 2024-05-20 10:50 , 【心情随笔】 ,https://bbs.deepin.org/zh/post/272708,22,1000,不好意思，本来不想说太多，但也有人看你们不顺眼，没办法，借我之手而已。
