title,post_user,post_time,type,links,post_reply,post_viewer,post_content
龙芯3A6000的机器，安装了LoongArch64的DEEPIN V23启动不了啊, 栖志浮云 , 2024-05-20 10:42 , 【问题求助】 ,https://bbs.deepin.org/zh/post/272707,20,417,如题，3A6000的机器，目前安装的是UOS20-1070。从deepin.org下载了V23的LOONGARCH64技术预览版，可以安装，但启动不了。
文件管理器无法调用VLC打开ntfs文件系统里面中文名的视频, 曾大波 , 2024-05-20 10:32 , 【控制中心】 ,https://bbs.deepin.org/zh/post/272706,2,170,在文件管理器中，浏览并双击中文名的视频用vlc打开会报错，直接在vlc里面，用打开文件菜单浏览打开视频没问题！
deepinv23密码锁定如何解除, sdxt1023 , 2024-05-20 10:27 , 【其他】 ,https://bbs.deepin.org/zh/post/272704,1,136,密码锁定300分钟，如何解除这个限制
机械革命无界15pro 8845hs 触控板或无线不可用, 130******09 , 2024-05-20 10:25 , 【内核/驱动】 ,https://bbs.deepin.org/zh/post/272703,2,93,机械革命无界15 PRO R7-8845HS,网卡 ax200
深度之家 需要改进, Tonny , 2024-05-20 10:25 , 【改进建议】 ,https://bbs.deepin.org/zh/post/272702,9,180,只能传截图，还限制1MB，为什么不像论坛一样可以传附件？同时文件大小限制(包括论坛)希望能提高到10MB
安装的软件在菜单栏出现两条相同的项, paloffice , 2024-05-20 10:16 , 【问题求助】 ,https://bbs.deepin.org/zh/post/272701,5,91,安装了群晖的客户端，从群晖官网下载的deb文件直接安装的，当时安装时候没啥问题，一切正常，菜单栏就一条项目，但是今天开机发现菜单栏莫名奇妙变成两条项目了，而且一条点击是可以打开软件，另一条点击没有任何反应，这是什么情况呀，如何删除那条没用的项目呀
v23rc启动器的背景不会随切换工作区改变, Tonny , 2024-05-20 10:11 , 【启动器】 ,https://bbs.deepin.org/zh/post/272700,0,64,
邮箱工具突然消失了？, paloffice , 2024-05-20 10:09 , 【问题求助】 ,https://bbs.deepin.org/zh/post/272699,5,103,今天早上开机发现邮箱工具没有了，我确定没有删除过，去应用商店也搜索不到系统自带的那款邮箱工具，这是下架了吗？
RC，笔记本电脑的蓝牙鼠标，卡顿严重，求助？, 学思 , 2024-05-20 10:08 , 【问题求助】 ,https://bbs.deepin.org/zh/post/272698,6,101,RC，笔记本电脑的蓝牙鼠标，卡顿严重，请问如何处理？
联想笔记本刷新率不对, 陆陆 , 2024-05-20 10:05 , 【内核/驱动】 ,https://bbs.deepin.org/zh/post/272697,2,92,笔记本型号2022小新pro14，分辨率正常2.8k，原本我的屏幕是支持120hz刷新率的，但是系统设置里只有60.01hz，无法调成120hz，打开系统设备管理显示分辨率正常2.8k，但刷新率只支持60hz，设备管理器里面显示驱动是最新的
任务栏问题, 深度之家 , 2024-05-20 10:05 , 【其他】 ,https://bbs.deepin.org/zh/post/272696,1,66,NA
周一了，上班了，事件该做了结了。, kuxise , 2024-05-20 10:02 , 【话题讨论】 ,https://bbs.deepin.org/zh/post/272695,5,759,不惹事，也不怕事，不解决是不可能的，先表个态，不会主动走，所以不要想着逼走别人的那一套。
清明节气壁纸无法下载, 166******10 , 2024-05-20 09:58 , 【应用商店】 ,https://bbs.deepin.org/zh/post/272694,1,63,一直提示源更新失败
没法调整任务栏位置, 深度之家 , 2024-05-20 09:52 , 【其他】 ,https://bbs.deepin.org/zh/post/272693,2,46,NA
右下角图标希望能显示出来不隐藏。, 深度之家 , 2024-05-20 09:45 , 【其他】 ,https://bbs.deepin.org/zh/post/272692,3,42,NA
deepin v23 rc是正式版吗？, 误差的时间 , 2024-05-20 09:35 , 【问题求助】 ,https://bbs.deepin.org/zh/post/272690,7,284,deepin v23 rc是正式版还是内测版？
我給Win10, LinuxMint, deepin v23RC的評分, MrHunt , 2024-05-20 09:33 , 【交流分享】 ,https://bbs.deepin.org/zh/post/272689,7,334,沒問題發問, 只是分享給大家用後感. 試用了deepin V23 RC三天. 100%代表最好, 0%完全不可接受. 我的要求: 除了人工分硬盤partition外,  其它都是按mouse鍵"下一步"就全部裝好, 跟着重起直接開始用. 我個人家庭使用: 文書, 網銀, 上網, 聽音樂,  Skype, 看視頻,  不打遊戲的.
